{
  "feature_id": "2026-05-08-tdd-missing-feature",
  "tier": "focused",
  "current_phase": "execute",
  "phases": {
    "execute": {
      "status": "in_progress"
    }
  },
  "skipped": [],
  "deviations": [],
  "commits": [
    {
      "sha": "b1a2b3c",
      "phase": "execute",
      "subject": "feat(scope): implement AC-1",
      "logged_at": "2026-05-08T10:00:00Z"
    },
    {
      "sha": "b2a2b3c",
      "phase": "execute",
      "subject": "feat(scope): implement AC-2",
      "logged_at": "2026-05-08T10:10:00Z"
    }
  ]
}
